cost,idea
0,Do singapore dating apps
0,"bathroom Plumbing
"
0,Watch the martian
0,"Gym, jacuzzi, and suana"
0,Comparrow
0,Birthday gift is to leave. I dont want to drink
0,Super shy NJ X twice trick it
0,"find portfolio website, host it on github pages, then post that link to salesforce"
0,Jay
0,"make a small game with my unity ideas like sokpop does, with chovin. small timeline?"
0,Tell legion health i dont think the meaning crisis will be solved online in that way. Link them to AFTMC
0,Buy a light phone case
0,"Laundry, then compile alterations\\\ = alexa"
0,add god bar back
0,whatsapp
0,keep coming up with pinoy lyrics to a melodyUseful not true
0,buy veggies
0,Get more wardrobe in singapore
0,Learn mandarin: duo and gpt
0,learn some mandarin
0,Import morning
0,Skillsfuture job fair
0,"gratitude. Singapore, sisters, travel, lky"
0,Grocerease
0,have nests per task
0,Office
0,"Problem: make gps systems better under covers, still accurate: map out when the data is good, then use walk speed to offline move the avatar cursor"
0,"Get a kettlebell
"
0,black mirror season 6
0,track the cleats
0,Charge phone
0,ask june if shes ok
0,"Fix whats expensive: housing, food, transport, energy. Schlep vision"
0,give sissy comparrow
0,Veggies
0,Another backlog is youtube playlists
0,buy creatine
0,definite optimism bracelet
0,buy veggies
0,"consider south SF, silicon valley instead of the homeless city"
0,cardio gym
0,Geralynn owes 200 sing bucks
0,unity project with chovin
0,buy a regular switch and wii sports
0,"just go to the flamingo meeting in singapore, i already turned in the notion weekly report so... no big deal. this is the easy route"
0,supergreen supplement container. like sissy's kale 30 serving thing
0,AI calendar assistant
0,ai that could look at my screen and perform actions
0,Adamtpangelinan
0,ruby Haircut
0,Fix face scars
0,learn how to kiss and have sex
0,soccer meetup singapore
0,tell sissy about youngji drinking series
0,Buy books at national library nearby
0,ted lasso season 3
0,Give my consulting friends the pathless path: daniel liem and oriol gasa
0,delete alec's comment on my python turtle IG post?
0,"get more dopamine, the obstacle is the way. jordan peterson at face value can be too much i think"
0,"make everyone use restrooms, then turn off generator"
0,Workout
0,"make a ""something is wrong"" button in frankenstein that has you pick what solution to do. it even tells you when to stop using it and use a journal instead or meditate or focus on your physiology"
0,unity project with chovin
0,get the phone holder in room
0,Have my genome sequenced so i know what best foods for me are and genetic deficiencies
0,"Make a player feedback doc. Seperate between niche and common advice, and tally when i get the same advice that i dont agree with. Players diagnose, devs prognose"
0,"give kamia and mama youtube premium links, again..."
0,switch to iphone and make sure sim is compatible
0,Veggies
0,Put book in bag so i have something to read when bored
0,Self piloting ships
0,"talk to temo, finish my draft"
0,get pants altered and other items
0,cleanup milanote accounts
0,phillipine airline online checkin
0,"Use google bard to scan my github codebases
"
0,"couldnt you take impressive bounded ai models, pair it up with the minecraft skill tree tech, like a plugin, to be general in the sense that it has all these tools. i guess the general AI test is how would it know to use what tool when? that pilot would have to be the general AI i guess. but the minecraft guys did it, with context. ill have to look into that more"
0,recurring sunset runs
0,"download milanote on mobile import time boxer tasks into milanote system, to be put into my frankenstein custom system later"
0,veggies
0,"Allocate cash: philanthropy, investment, other business, food, housing, transport, leisure, etc."
0,give comparrow to sissy like i said i would
0,"i can always talk to CTE, dads friends, will castro, chris barnett for connections to guams leaders to orchestrate positive island change, like singapore did"
0,bezos productivity
0,"why cant whatsapp be merged with twitter or instagram? why are the same functionalities seperated with different apps? public posts, pictures, dms"
0,rewatch silicon valley
0,tabs
0,book the other gocity tings
0,https://www.youtube.com/watch?v=4aYVLpY5FYU&list=PLYsIbuizZWe9vmZVv4AICcpcey7Eu3Lmm&index=2
0,put a curtain / shade over grammy's door
0,Copy the sudo service postgresql start? Check online postgres command to cheatsheet
0,checkin bags online
0,Learn basic mandarin
0,"Imagine a spain singapore or in india, a south america one"
0,give derek sivers my email already
0,Connect w rebecca kim on linkedin toolp
0,"Serenity prayer yin yang, definite optimism, memento mori bracelet from sis please"
0,Try the gpt alpha features
0,ask to travel to the states for time zone reasons
0,glue rubber back onto laptop
0,"Reply to june, ask her if she lives here on guam"
0,A-pop company of la dancers
0,clean toilet
0,Grocery shop
0,get a adam.site domain
0,Put back bed in my room?
0,have peeramid suggest what to work on and in what order
0,maps of meaning
0,"ff: before comparrow compiles all tasks, it removes dupes"
0,Ai book summarizers
0,Coffee from 730
0,"ff: export all the golden tasks into your clipboard, along with a temp notif that that happened"
0,quantize iphone home screen
0,"read books: Austin kleon trilogy, Zero to one, The creative act, Sapiens, Mans search for meaning, Crime and punishment, tribe of mentors"
0,"figure out comparrow packaging, then give to sis"
0,"Give dj a few songs, he makes a playlist from that vibe"
0,Look at per nation and global gdp metrics over years
0,Find old ac milan jersey
0,Check if internships need education concurrent
0,go to sissy
0,fix teeth with new enamel and cavity tech
0,"Edtech with ai, websites, wikipedia scraping or somethin"
0,Get clothes lisa altered
0,Charge my anker portable charger
0,sibling minecraft: put minecraft on babies ipads
0,get the volleyball schedule from miguel
0,Check the career coaching/sprint cheatsheet
0,tell homies i have power and water if they want
0,learn blender basics
0,setup a MERN meetup time for daily standup recurring in calendar
0,seb lague godot
0,buy the sokpop monthly subscription
0,Big demon hunter deck
0,Allowance
0,self authoring
0,"Buy bags of spinach and eat it for cholesterol reasons
"
0,check charging system in truck
0,make my prototype 2.5d?
0,@career and responsibilities are in a more stable state: 1
0,one pace
0,go over alex grace boxes again
0,kamia exam project
0,"Sunblock before soccer
"
0,"make a schedule with kian, adelup, working out on fridays, monday this time, coding meetups fridays, sunday morning yoga, interspered with hill runs"
0,fifa
0,download all of the office
0,finish up typhoon stuff outside
0,grocery shop
0,"Add rick rubin and sokpop to role models
Make a tier list with reasons on blog"
0,"Im a man of culture fage yogurt meme
"
0,Fearset
0,Recurring creatine
0,Clean house
0,Make sure miguel aint made at me cause i was annoying with bar and club comments
0,"neetcode studying, asking nick to help test me for the job market. reviewing my technical and non-technical materials. study neetcode recurring with chovin"
0,make a 3-5 loadout / deck system just like terraria has
0,"make a time boxer with variable auto looping work and play yin yang styled ting. with labels for what youll do in each block. the yin and yang symbol should be visually transfering colors, like an hp bar"
0,"make a weekly workout schedule w/ miguel, at least once a week. flexible working on what is best for our goals"
0,Vervaeke confusing signals of depression and anxiety. dont commit suicide
0,What would it take for me to be satisfied?
0,check fd chat
0,"Find my gaiman gazebo
"
0,schedule in adelup soccer and infusion coding meetup
0,buy nuts
0,"Get money from dad for singapore, 500"
0,ff: label in comparrow to put all the golden tasks back into keeps
0,Find another kleague team
0,Sing = guam x sf
0,Ask uncle steve for job advice cause hes so linkedin?
0,Follow becca salas on IG?
0,"buy a batbox for laptops, plug and play"
0,learn mandarin
0,try contract coding work from nick at the coding meetup
0,zombies in western culture
0,Consolidate google keep notes
0,turn off power
0,put almonds on mamas todoist
0,Veggies
0,"ff: i can import whatever format of task and comparrow will standardize it all: stripping blank spaces, getting rid of ratings, nesting subtasks in key-value pairs, if there are commas, wrapping the task in apostraphes"
0,job/austin research for meaning/reason motivation
0,learn ios development
0,connect with more people on linkedin
0,"get rid of the stuff in my room, one thing at a time. minimalism style"
0,"Aloe myself from our plant, refridgerate it
"
0,work for kongregate to fix the website
0,follow soccer guys on linkedin
0,learn chamorro
0,less comparrow after taking best tasks and timeblocking
0,read coding docs
0,"ask mama for an increase allowance, with reasons and proof."
0,check beyerdynamics when they open
0,Go minimalism
0,get receipts out of truck
0,put ex-musician in social media?
0,Have seb pay me for pieology?
0,"ill put a lamp to substitute in the hallway
i can put some cardboard to cover the light for the bathroom window"
0,"make comparrow look way cooler and make it intuitive, foldable, and modular somehow"
0,fashion
0,make sure to add boarding passes to google wallet for a backup qr code
0,hs handbuff dk
0,recurring sunbathing for hormonal release
0,Get haircut
0,"Ff: make a copy and export eisenhower golden tasks feature, to clipboard"
0,recurring mewing
0,learn about lee kuan yu
0,Read meditations: Put it in my backpack
0,Switzerland
0,go on a run
0,Cancel instacart plus and uber one
0,Clean carpet of skin and nails
0,"fix whatsapp notifications, be able to have notifications for mother and father ON MY LOCK SCREEN"
0,life portfolio. pay off cc
0,slow carb diet one week again to lose fat body composition
0,"custom sleep app with all the timing things i want (sleep cycle, caffiene intake, fasting schedule etc.) when to go to sleep 10pm, when to wake (sunrise)"
0,Investigate if dangers of looking at close range screens for too long
0,grocery shop after a week of typhoon recovery
0,y combinator and hackernews jobs
0,kindle please
0,eyeland playlist
0,"Look at gpa employees, like melvin quec"
0,practice touch and passing and dribbling
0,fill out Alex Mak's weekly form
0,Make a chatgpt to voice audio extension for chrome?
0,Buy a double flask for multiple drinks
0,Make a soccer card game but positional like sbcs or team builders where positions and symergies matter against the oponent. And deckbuilding and sequence. 
0,pokemon
0,"ff: add a post ""this"" task bucket"
0,"timeboxer, some way to focus at home"
0,stop subscriptions i dont use
0,"AI comparrow without the tinder swiping, you set the paramaters and weights though"
0,Stella singapore 🇸🇬 
0,have a shirtless musly pic
0,"get my clothes altered at lisas or the mall one, get a time estimate of each"
0,moussa
0,get mama a standing desk for her birthday
0,cancel MTFC with homies and give mama back tix?
0,Muse: school dropper and pickerupper
0,ff: individual rerating
0,Learn mojo
0,switch beds with sissy's
0,Mila ting
0,make a blog post about luck and peter thiel and naval
0,"make a comparrow feature list on milanote with: longer listboxes, wider input and scale, remove save button. when you save, remove the starting numbers and pipes if any. add god bar. make it packaged and send to sissy. **"
0,Coffee
0,ftb
0,"dm june on ig, ask about if shes okay from the typhoon"
0,Buy a luggage 
0,blueberries
0,Get havianas jimmy dees beach grass parking lot
0,"its okay, if i dont remember my dream. surrender"
0,get a beatles suit
0,take more selfies
0,Make a cool guy playlist
0,"Technify idi, create value, save value spent. Digital picksheets. Idi website. Idi ordering website. Crud app. Needs robust server"
0,Get another window shielder for truck
0,ice bath
0,"go on psychadelics with an expert, in a sensory deprivation tank, and pre and post documentation, and some structural pre and post prep, and talk therapy"
0,brush
0,Import morning
0,consolidate todoist and calendar
0,Ai translator
0,nap 17 minutes
0,Schedule in soccer recurring
0,say thanks to nina and nino for jordan peterson
0,investigate anthony bordain dying. why
0,"Find that seraphim cherubim acoustic song recording lyrics
"
0,"Get beach photos, 2 phones ask mama and kamia"
0,Send auntie yuri screenshot of the highest paid gov official albania 🇦🇱
0,links to sissy and auntie rese: mythic mountain and packaged comparrow
0,"download local multiplayer games: buy switch regular, or switch 2?"
0,Workout
0,buy rick rubin book and zombie vervaeke on audible or kindle
0,Know my debt date
0,Tell jasmine nevermind about peeramid for now
0,clean yard
0,Dalio principles
0,the ramit sethi netflix show
0,Make surp
0,Follow asia IG
0,pur gum
0,Massage
0,"after i finish eisenhower tasks, repopulate, rerate"
0,HP power cord
0,Find the japanese fighter cartoon network show
0,"start an online presence: revive blog, book, spotify, youtube channel, podcast, video game"
0,Setup death squared for tonight
0,https://www.youtube.com/watch?v=Rdo9SsFo_e8&list=PLYsIbuizZWe9vmZVv4AICcpcey7Eu3Lmm&index=2&t=6s
0,Journal
0,miguel soccer
0,Get mama lucy gum
0,miguel borderlands
0,Follow becca and asia ig
0,The creative act
0,aftmc
0,finish the office
0,download more games on steam
0,Reach out to momo ko to be my artist
0,"what would happen if you sparked an AI talking to another AI back and forth, with other skills like embodiment"
0,Make a social productivity blog post 
0,"Spatial positioning open source chess pieces that can play eyeland, with programmable, bucket charging pieces"
0,release my art on IG
0,splice again for eyeland sounds?
0,tell mama im making eyeland and i feel whole at least the life chaos side of life
0,waiting for godot
0,Check if micropac is done with my beyerdynamics
0,image search June
0,fix the back-right brake light
0,Get a sketchbook and aim for volume for diff cards
0,What if everything is a card? Like you and enemies?
0,"i need a paperclip to put the atnt sim into the iphone, to pause the atnt bill"
0,pluck brow
0,https://www.youtube.com/watch?v=g7D35v2y5Oc&list=PLYsIbuizZWe9vmZVv4AICcpcey7Eu3Lmm&index=2
0,get a rasberry pi
0,Call discover to talk about over credit limit at payless
0,self diagnosis
0,buy guitar strings for nylon and baja
0,cancel instacart
0,Get more plants for the house
0,"Change my best pic on dating apps
"
0,recurring import tasks (from sources (see previous notepad yellow pages))
0,Have an acoustic show with favorite covers and some written songs
0,"local phone app, eisenhower tinder but with nested tasks, conditional snoozing, easy imports and exports. cycle tasks feature, atomizer, diagnoser prognoser"
0,Amazon order Jbl battery: Check wishlist
0,Download the ai llm tutorial from openai guy
0,8 sleep mattress
0,+ check glassdoor for jobs too
0,play minecraft
0,Check if jack jack is okay
0,finance meeting w mama life port
0,import kamias paddling calendar
0,alterations
0,Pop so im not so aggressive
0,decorate my room with art
0,"Finish the senior song and send to fd chat
"
0,cancel midjourney
0,    go through all comparrow tasks again when im done with whats on my plate
0,signal-detection theory
0,"AI resources: andrej, sebastian lague, 3blue1brown"
0,get a benefit cc
0,Wash hands cause receipts
0,send to sissy and auntie rese and justine: https://bubbapang.github.io/mythic-mountain/
0,move the groceries/shopping lists from todoist. find a better place like milanote
0,Reacttothek
0,process popping even when i dont to necessarily and getting a girlfriend.
0,Look at young cities when deciding. Or young areas in general. And other compatibility variables
0,"Human time, not just temporal time"
0,learn how to make vscode extensions
0,get rid of excess notes in google keeps. archive them all
0,learn the open ai chatgpt tutorial thing
0,have mama try the slow carb diet
0,grocery shop
0,Change the paintings on the walk in room wall with the paintings we made that one time
0,check google calendar
0,Add alana lintao to GIWD
0,quantize life portfolio
0,"figure out why i dont do grocerease, cause i dont want 3am meetings, cause i dont want a time intensive job rn that gets in the way of eyeland"
0,"go for a hill walk w/ kamia?: swap different colored bottles / batteries up and down the hill, with shrines at each checkpoint"
0,have 2 phones with both sims
0,"after making comparrow cooler, package and give to sissy. part of making it better is making it foldable, styled, and include nice instructions and labels and tooltips"
0,"listen to all shazam, soundhound songs"
0,nina tricie lab text
0,"chargers everywhere: samsung, iphone"
0,checkin bags for PAL = getting boarding passes once we get to airport and give em our bags
0,"When i get a job, go on a kpapas trip"
0,get an arduino kit
0,Venmo david for ramen
0,"Stax date idea
"
0,"recurring see dad, hes bench"
0,fix ubuntu zooming
0,Ken norton. Tim said VERY smart
0,clean toilet
0,"Slide into beccas dms and ask hi, after following her. Then ask her on a date: find a good spot: question why im afraid?"
0,Direct morning sun
0,remove atnt autopay
0,Damage pallete
0,setup recurring TA help for sprint period
0,buy more shorts
0,find my portfolio website
0,quantize discord friends list
0,lifo onetab
0,seoul mart ice cream
0,clean car
0,"Can alterations finish in one day?: For how many items?: Finish laundry, compile what i want, then ill know"
0,Talk to mama about increasing allowance. Even ask for loan until i get a job and that im keeping track
0,quantize google photos after importing gallery to it
0,Save computer data to the ssd
0,get more strawberries in damaged tomorrow at IDI
0,"workout tomorrow, find motivation for dating"
0,set up coding meetings on monday
0,get a points cc
0,ask gpt how to get into hardware and chemistry and electrical
0,Look into huntr.io and make sure im logging in my work and that im not messing up with that.
0,Buy more on amazon in bulk
0,Get a small notepad for pocket
0,Undo linkedin premium
0,pump
0,ask miguel to just hangout from sunrise to sunset
0,play all the blackthornprod pass the game challenge games
0,faceoff with chinese youtubers with nana
0,go over the greenlight checklist
0,gingko bioworks
0,Add a calendar event export handler in frankenstein
0,"Cold aloe
"
0,recurring brush at night and floss
0,"Ask parents for allowance still while i job search for a remote, cool yc company"
0,revive blog
0,recurring what is heaven like
0,Make the next goals about increasing agency. Dont put yourself in situations where your agency lessens too greatly
0,beta carotine
0,"Invite fifa boys to adelup soccer and kleague. Say josh bamba goes to kleague, and older fd boys go adelup, theyre chill
"
0,steam
0,have IDI look into gusto
0,Make a signature
0,"When justin is at the shop, show him the bulb, then hell tell me what part to get at napa, then ill get it, go back to the shop, and learn how to change the reverse light"
0,toothpaste
0,batch interupptions = interuppt coalescing
0,return mr lee's carpet and offer to take down the canopy
0,Have sis do my brows
0,fix the format sd card issue on switch AND download more cool games that ive already bought anyways
0,life port
0,"find way to automate paypal balance to allocate to chase, then chase will autopay its cc and discovers based on funds available. set minimums and thresholds and shit"
0,"Get miguel a nice gift
"
0,contact ananya chadha for a reason. find her contact
0,Game night/switch nintendo/dinner at dads with sibs
0,gratitude
0,somehow get serum back into ableton
0,Check micro1
0,buy mouthwash
0,after i figure out my productivity system. make a blog post and share the tools (packaging necessary)
0,Voice deeper. Testosterone optimization
0,procedural animation
0,look at a ramit sethi rich life checklist
0,learn how to text over dating apps
0,hangover cheatsheet
0,tell godot to make 2d 3d script tabs pertinent to what you click on
0,"get my beyerdynamics, call micropac first"
0,Apologize
0,"Get another ssd and have lagging backups like sivers. That would take multiple server racks, follow his tutorial"
0,Put taking out trash back on recurring calendar. Every monday afternoon. And recycle every 2nd and 4th friday of month
0,na' babui
0,Amazon order Hp cord
0,leave house to change truck's oil. get specific oil from mama and change truck oil at pacific tyre dededo
0,Follow sen on IG
0,Bring marshallpods. Put in bag
0,Experiment with living at dads after the trip
0,kickstarter my video game?
0,go to dads. ask chelus for game night. board games and switch. tell dad what they say asap
0,Get mama a halogen lamp
0,Optimize fertility
0,"Add all shazam songs to spotify, and listen to discover weekly"
0,"zero to one again, parse my library, analog and digital"
0,recurring serenity prayer
0,make a lets play w someone
0,dagan cat guam eyeland joke
0,Miguel and seb reunion
0,Follow becca and dm her on ig
0,make sure to bring chovin in on eyeland
0,put almonds in mamas todoist
0,finish the meaning crisis
0,"be chill, dont overstimulate"
0,"get a work life balance startup job with good compensation, team, location in austin, and time for my side projects too"
0,clean grout on floor
0,sleep
0,Learn basic law with chatgpt and research for business and gov law
0,import the backlog notes into milanote
0,ff: get rid of blank space before and after the task's first and last words
0,symmetrical body muscle
0,check google calendar
0,"Recurring get out of the house. Consider the inaction cost of staying home. Find better places to work: stand, rest, work, eat nearby, nearby house, late hours"
0,make ableton kpop again as play
0,Make the task dump for frankenstein fifo
0,kamia take medicine
0,Make a 5 minute daily vlog app
0,Singapore mila calendar prioritization
0,"i have full confidence that well get this done. im just not convinced things have to be so hard. you first be, then do, then have. ive seen times where the guzman way wasn't the way: uncle joey doubting me about the bamboo ladder, then i just made it. i just cleaned sissy's room with ease using my blank meta method. sustainable effort, elegance."
0,power adaptor
0,Singapore red light
0,Floss
0,setup my own server rack that can hold multiple ting
0,buy bagels
0,Look at whats common ACROSS the top tier
0,Import grocery lists from todoist into pinned notepads
0,Do after singapore: 
0,make a keeping up with the pangelinans chat: nana sid t auntie creed ange dad kami me sis roman aaron jack jack kieran kody
0,"ff: make an ""@"" tagger for comparrow + extend the listboxes"
0,Hangover cheat sheet
0,"Ask derek sivers or paul millerd for career advice and explain my situation, say im sorry for extracting, say i tried the internalised sage approach, and say hopefully they can lead me in a good direction or break my frame on this and facilitate insight"
0,+ have kami send me that car photo that's nice
0,"ask mama about allowance / financial meeting, after i go minimal"
0,clean dining
0,put black tape on sissys AC light
0,"Reach out to 908 and app academy guys
"
0,trim fafa' hair
0,schedule in champions league final
0,put away mat outside
0,Walk with family up sabana sunset
0,ask temo for career advice and ask about coding minischool: summer camp or fd bois
0,"Reach out to Aa classmates, 908 peeps in tech, and that guy friends with aaron jung we went to jordan peterson"
0,put toothpaste and brush in outside baff
0,"make music again, album in a game. standalone songs in eyeland"
0,look at alex's slack message
0,"check if luke's alright, lately hes been mad at me or struggling in life elsewhere idk, but i should check on my primu once i put my oxygen mask on first"
0,key receiver
0,check if adelup soccer is still on
0,change grocerease to a a different ecommerce site to make it more exciting?
0,Play sokpop collective games
0,rank order guams problems
0,"switch to iphone: learn how to factory reset online, or switch from samsung"
0,finish begin again
0,grocerease
0,"tell mern group sorry i couldnt finish css this morning, ill try to be there tomorrow"
0,download more on youtube and hulu and such. all of the one pace torrents
0,"Have mig send me the pics he took of me
"
0,"Publish my first youtube video. Short, elegant, useful or cool. Release, turning the dial"
0,part time youtuber academy
0,Work with miguel?
0,Put sim in iphone. Get paper clip
0,Get a better sunshade for truck
0,Go through career playlist
0,i can ask for a loan to hold me off until i get a job
0,Go to an open cafe?
0,download the 2 procedural animation videos: ruben and creature catching rpg devlog
0,ask her on either a tumon beach picnic date or a morning coffeeshop date in a cool part of town
0,coding meetup:
0,import notebook tasks/ideas
0,figure out seb vs miguel lunch schedule after tech mats
0,Check the generator gas level
0,learn how to make chrome extensions
0,blog post about overcoming the guilt of past public commitments
0,"Put my pic on dating apps + instagram
"
0,ask carmen quec's daughter for drawing advice
0,Get the beach photos from kamia and mamas phones
0,Add instacart to guam so people can get groceries without going
